{
  "id": "product.outreach-agent",
  "kind": "section",
  "category": "PRODUCT",
  "surface": "light",
  "claimsPolicy": "none",
  "purpose": "Present Agent #4 Outreach with a sticky title panel beside five stacking cards in deepening blue.",
  "description": "Agent #4 Outreach: sticky left title panel with five sticky stacking cards in blue tints on the right.",
  "implementedBy": "src/components/OutreachAgent.jsx",
  "evidenceLevel": "measured",
  "scope": {
    "templates": [
      "template.home"
    ],
    "routes": [
      "/"
    ],
    "routeCount": 1
  },
  "constraints": {
    "onePerPage": true,
    "maxPerPage": 1,
    "allowedTemplates": [
      "template.home"
    ],
    "allowedRoutes": [
      "/"
    ]
  },
  "variants": {},
  "fixedChrome": false,
  "content": {
    "type": "object",
    "additionalProperties": false,
    "required": [
      "title",
      "agentNumber",
      "caption",
      "cards"
    ],
    "properties": {
      "title": {
        "type": "array",
        "minItems": 1,
        "maxItems": 2,
        "maxWords": 5,
        "observedMax": 2,
        "items": {
          "type": "object",
          "required": [
            "text"
          ],
          "additionalProperties": false,
          "properties": {
            "text": {
              "type": "string",
              "minLength": 1,
              "pattern": "^\\S(?:[\\s\\S]*\\S)?$"
            },
            "tone": {
              "enum": [
                "default",
                "accent-green",
                "accent-blue"
              ]
            },
            "breakAfter": {
              "type": "boolean"
            }
          }
        },
        "examples": [
          [
            {
              "text": "Outreach",
              "breakAfter": true
            },
            {
              "text": "Agent"
            }
          ]
        ]
      },
      "agentNumber": {
        "type": "string",
        "minLength": 1,
        "maxWords": 5,
        "observedMax": 1,
        "examples": [
          "#4"
        ]
      },
      "caption": {
        "type": "string",
        "minLength": 1,
        "maxWords": 5,
        "observedMax": 5,
        "examples": [
          "Proactive Patient Engagement & Follow-Ups"
        ]
      },
      "cards": {
        "type": "array",
        "minItems": 5,
        "maxItems": 5,
        "items": {
          "type": "object",
          "additionalProperties": false,
          "required": [
            "index",
            "title",
            "text",
            "icon"
          ],
          "properties": {
            "index": {
              "type": "string",
              "minLength": 1,
              "maxWords": 5,
              "observedMax": 1,
              "examples": [
                "01"
              ]
            },
            "title": {
              "type": "string",
              "minLength": 1,
              "maxWords": 5,
              "observedMax": 4,
              "examples": [
                "Targeted Campaigns"
              ]
            },
            "text": {
              "type": "string",
              "minLength": 1,
              "maxWords": 10,
              "observedMax": 10,
              "examples": [
                "Send customized messages about new services, promotions, and updates."
              ]
            },
            "icon": {
              "type": "object",
              "additionalProperties": false,
              "required": [
                "assetRole",
                "assetRef"
              ],
              "properties": {
                "assetRole": {
                  "allOf": [
                    {
                      "$ref": "#/definitions/assetRole"
                    },
                    {
                      "const": "product.outreach-icon"
                    }
                  ]
                },
                "assetRef": {
                  "type": "string",
                  "minLength": 1
                }
              },
              "examples": [
                {
                  "assetRole": "product.outreach-icon",
                  "assetRef": "/assets/6883f34c4e63a9b69a4e5d84-out-icon-01.webp"
                }
              ]
            }
          }
        }
      }
    }
  },
  "contentFields": [
    "title",
    "agentNumber",
    "caption",
    "cards"
  ],
  "assetRoles": [
    "product.outreach-icon"
  ],
  "composes": [
    "stack-card",
    "media-cover",
    "label-eyebrow"
  ],
  "motion": {
    "allowedPatterns": [],
    "reducedMotionFallback": "static-no-motion"
  },
  "responsive": [
    {
      "at": ">=992",
      "target": "split-cards-left-wrap",
      "property": "position",
      "value": "sticky top 60, height calc(100vh - 60px), 50% wide"
    },
    {
      "at": "<=991",
      "target": "split-cards-left-wrap",
      "property": "height",
      "value": "calc(60vh - 60px)"
    },
    {
      "at": "<=767",
      "target": "split-cards",
      "property": "layout",
      "value": "column; left wrap not sticky; cards 60vw tall (80vw at <=479)"
    }
  ],
  "measuredFrom": [
    "CLONE_SPEC.md:318-337",
    "src/components/OutreachAgent.jsx:8-38",
    "src/data/outreachCards.js:5",
    "ia/ia.json:157"
  ],
  "notes": "The stacked-deck look is pure CSS (colours and fixed translateY offsets); no tweens."
}
